ConvID,Title,OriginalText
3056p1,,"I get that cabs have to get people from point A to point B in a timely manner but it is a huge pet peeve of mine when they bully other vehicles on the road way.  I was in the left lane driving through a light onto a bridge.  The left was for the bridge and the right lane was turn right only at this light.  Since it was before 9 there is a bit of traffic on the way to work but nothing crazy.  The cab drives up the right side and cuts in front of my car.  This is where I honk the horn, as he is only a few inches from hitting my front passenger side bumper.  He of course does the arm waving and flipping the middle finger thing, which ehh I do that myself.  But then looked like he was about to get out of the car when we were stopped on the bridge.  I locked my doors and got my phone out, took a couple of photos of his car including the cab company info and the state info. When the light changed again we started to move and as it opened up to two lanes at a T intersection (left lane is left turn only and right lane is right turn only) he did it again to the cars ahead of us and moved into the right lane and then turned left cutting off the cars there.  The cars had stopped to not block the intersection but the light was still green.  
  
I called the cab company and had to leave a voice mail for the complaint department. After looking online, I saw that this company has some problems resolving complaints anyways, and they want the city to ban Uber and Lyft drivers even though they are horrible with customer service.  So after a few hours I decided to file a complaint with the state commission that licenses cabs.  Am I the asshole if this guy looses his job over a bit of road rage and bad driving?  "
30dtf7,,"**Background:** I have this co-worker who needs help with every move she makes.  I'm not a manager, but the office expects me to function as her manager, because you can't simply give her a task and expect results.  You have to explain every step of every job to her.   This is a college graduate who, if asked to neatly write and mail an already drafted letter, needs to be instructed how to use a word processor, how to print, etc. and does not seem to retain these lessons (nepotism at work, folks!).   There also are several things that are my job that have to be accomplished before she can start working on her part of the job.

So it is understood that anytime she works, she can't do a fucking thing without me dropping what I'm doing to set her up, and support her, and even familiar tasks require frequent interruptions after I get back to my desk.  Because of this, I have her come in on the same day every week, do all my work for he first, and I don't schedule anything else or let anything get close to a deadline that day, so if I lose the day, it doesn't cause any huge problems.  

**So here's the question:**  She can't come in on her normal day, so she just picks a random day and comes in without warning 30 minutes before I leave and starts working.  I drop what I'm doing, show her how her job works as usual, and just don't accomplish anything at the end of my day.  I leave when I'm supposed to, and she's still working.   The next day, the phone is ringing off the hook because the boss (her husband) decided he wants to execute something very complicated on an immediate deadline, and I'm collecting all the info &amp; finishing up documents that are involved while he checks in with tweaks and changes.  Boom, she shows up because she couldn't finish her job yesterday since I wasn't around all day to tell her what her password is, etc.  So she just appears and expects me to jump and tell her whatever little thing she needs to know first.  It's 1 hour into my day and I "
30hobf,,"Title says it all

Edit:  ok let me add a little background.
 I asked her to lunch a year ago, she told me she did and i backed off. Come December at the holiday work party, i was getting her car gas and she jumped me in the gas station bathroom and told me about the boyfriend as we were winding down. But i've continued with it this long. So Am I The Asshole?"
30jnon,,"Okay, backstory. I have a friend with a dog. Her lease is up this month and she needs to stay in the state for two months so that she can graduate college, the only problem is that while she is couch surfing, she can't have her dog. This is where I come in. I told her that I would be willing to watch her dog, we already have pets in the apartment, my landlord gave me the OK and I talked to my roommates about it, they were down, so long as we got a trial run. 



Cut to a few weeks ago, I dog sit while my friend is out of state on spring break. I tell my roommates to tell me if they see or notice anything that would turn them away of keeping the dog for the two months my friend will be homeless. I told them to tell me if there were any problems as soon as they noticed. Does he chew on stuff, if they started feeling allergic, if he was to loud, and so on.



Now today is the first day that we had the dog. I let my roommates know that he would be coming sometime this week, my roommate comes in and asks if this is the start of the long time we would have him, I tell her yes. And she flips out and tells me that she doesn't think that it will work and that she thought we were going to talk about it. I tell her that I explicitly said to them that they needed to tell me if there were any problems during the one week we had him so that if it was something we could fix that we could get it taken care of; and if it was something we couldn't fix then my friend and I could find him somewhere else to live. She is instant that she is allergic to him and I just tell her that she should have told me earlier. That way we could have found some place different. 



I eventually told her that I would try to find someplace for him so that she didn't get to uptight, but until I do he has to stay with us. So, am I the asshole?"
30nvml,,"My parents want me to go to the local community college, but like a lot of teenagers my age, (I'm a junior in high school) I want to go to college at a university in a larger city. My parents however aren't going to help me pay for college regardless of what I do, and they think I'm being ""rebellious"" and that I ""just want to party with my friends"" by wanting to go somewhere else for college. They also think that I'm going to end up with thousands in student loans because I'll be in college for 5-6 years because I'm partying so much. The student loan is a legitimate concern, but partying and extending the time I spend in college? Not so much. My grades are pretty decent in school (mostly A's, a couple B's, no C's, D's, or F's) and I'm taking AP and DE classes.(which are college classes that you can take in highschol for those who don't know)


My brother went to this community college, and got a job, and is now well off without any debt. However, he encourages me and wants me to follow what I want to do and go to a university. He told me that he feels like he never had the ""college experience"" and he would've liked to. He also told me that even though he graduated debt free, if I were to keep student loans to a minimum (around $5,000 or less) it wouldn't really be a big deal at all to pay off.

Am I wrong for wanting to do something different from what my parents think is best?"
30o4zh,,"Background: I'm a student in university. I've been seeing this girl for the past couple of months, but recently we haven't been able to see each other due to conflicting schedules. This past week I sent her a text message inviting her out to dinner and mini-golf during the weekend. She didn't reply for a day, so I sent her another message saying that if she wanted to do something else I was open to ideas. After waiting two more days for a response, I told her that she could have at least replied, to which she replies that she's been swamped with work. We got into an argument about it, with her saying that people get busy and me saying that it would have taken her 10 seconds to send a reply.

Am I the asshole? I like this girl, and if I'm the asshole of course I'd like to apologize. However, I've been known to be a pushover and I'm trying to change that. Don't pull any punches, I want the truth. Thanks for taking the time to read! You're helping me become a better person.

"
30omuy,,"OK, another work situation with a girl I'll call M. 

  I work on the customer service desk with M, and the rule is that if you can't do a shift, for whatever reason, you should attempt to sort it out yourself and get a shift swapped with someone else, which my line manager is usually pretty much fine with (saves them the hassle of changing rotas). 

Now something I should mention is that usually three weeks worth of shift timetables are available. These are pinned up in the managers office, the staff office and there's a copy behind the CSD. Anyone who wants to check their shifts (or needs to) can go and consult any of these copies at any time. 
  
A few weeks ago, M asked me on a Friday afternoon if I could cover a Saturday shift, to which I said no. I found it totally unreasonable that I was being expected to cover a shift with less than 12 hours notice, and I wasn't particularly happy that her 'reason' for wanting that day off was 'because I promised my little girl we'd go shopping'. To me, the shift timetable had been up for long enough that if it had been that important, she would have spoken to the line manager and asked not to be put in a shift that day (which is entirely possible, I've done it). I told her this in a polite fashion and advised her gently that if she had availability issues, she needed to go to a manager and actually tell them. 

  Skip forward to last two days ago and she seems to be pulling the same thing again. I'm now covering her shift today for what appears to be similar reasons, and I'm not happy as this was supposed to be the start of 4 days of holiday for me. 

Now fair enough, things like childcare are an issue, and I can understand if some genuine reason to do with the kids or whatever is an issue, but to me the whole thing looks like she's using this as a trump card, and I'm being expected to give into every demand. magically virtually every other person with children in the store seems to cope just fine. 

So, AITA here?

EDIT: I"
30xh5m,,"Yo /r/amitheasshole! 

To preface, I carpool to and from my school with my middle-school age sister and a few neighbors. What's happening is my sister sings a lot. She takes lessons and stuff, and I'll admit, it's not necessarily bad. However, do not let her get near a car, because the second she hears Uptown Funk or Blank Space (among many other songs) on a station, she will belt out the entire song until it's over, then sometimes change the station to look for another song to sing. It bothers me to no end (my neighbors don't really care either way), and when I ask her to stop, she always scoffs and tells me I'm being rude. Am I the asshole in the situation, and is there a way to solve this? Sorry if this belongs in another sub. Thanks!"
55fmd6,,"I share a front garden with a neighbour and the front garden has maybe 50-60ft of hedge. We have shared this garden for probably 2.5 years and in that time I have (not figuratively, literally) always trimmed the hedge, disposed of the cuttings, blah, blah, blah... 
(I bet you've guessed where I'm pettily heading...)

So I had a really busy month at work, then went on a week long holiday, and DID NOT trim the hedge at all. So by this point it was as unkempt as a bag ladies bush. It really did look shit.
So my neighbour hires someone to trim the hedge, or maybe did it themselves, but I doubt it. But not the whole hedge, just the half that fronts their house. 

So this has really wound me up, far more than it should have for a supposedly well balanced individual. To the point where I have decided to no longer do their half of the hedge when I trim in future, despite this being likely to just piss me off as I'll still see the messy hedge.
So a two stage asshole question;
1) Am I an asshole for assuming they would reciprocate the work I had done if they ever did trim the hedge? (noting I didn't leave it to see if they would, it was just because I was busy/away)
2) Am I an asshole (preemptively) for deciding to only cut to the boundary that they went to next time I trim the hedge? 

Tldr; petty dude (also quite drunk) mithering about pointless bullshit, don't bother if you didn't read it the first time round...


EDIT
Well, it appears I'm not overwhelmingly an asshole (in this instance), but am probably petty, quick to judge and possibly unreasonable. Thank you internet!

If anyone is interested I will probably not do their side for a while and then just start again. Though it is coming into winter now so by the time it needs trimming I'll have forgotten all about it anyway... in addition to being petty etc I also have a bad memory!"
55j280,,"My friend and I are both in the process of moving across the country (east coast to west coast) and he has been planning what cities and attractions we will be seeing. I had no problem with this, as he is pretty good at finding interesting stuff for us to do. At the beginning of the trip he gave me a list of places we would be stopping, as we will be splitting off so that he can move south and I can move north. One of the stops listed was Las Vegas. I figured that would be a good place for us to part ways, so I told him that I would be our last stop together. I also told him I was only planning on staying in Las Vegas for a night.

My dad heard about our plan and decided to pay for a nice room in Vegas as a gift to me. I confirmed with my friend several times the date that we would be arriving in Vegas, then had my dad book a reservation for that date. A few days before we arrived in Vegas, my friend's parents met us so that they could continue the trip with him to his final destination. This was fine, as they had told us they had reservations in Vegas the same night that I did, so I assumed my friend and I could hit the strip before I left.

Fast forward to the night of the hotel reservation: I get checked in around 5:30, then my friend texts me that his parents actually booked a hotel an hour and a half outside of Vegas for the night my hotel was booked (despite both of us thinking that they would be staying downtown). He said that I should just do stuff on my own, and then he and his family would be in Vegas early-ish the next day. I told him that I wasn't planning on sticking around for very long the next day since I had a six hour drive before my next stop, and asked that he leave his parents after dinner and stay at my hotel, then we could all meet up in the morning. He said no, that he felt bad but he wasn't going to leave his parents. I told him I felt bad that my dad was spending all this money for a hotel because he thinks we're having a fun night together"
55nipi,,"Now I'm not going to name this user of course. Also they've since deleted the journal that this happened on in question, so I'll be paraphrasing.

So this user has made various depressive journals, and this one in question talked about how they wished they could make all humans disappear and undo the damage we've done. I took a bit of umbrage to this idea, and told them that I disagreed and thought that we should better ourselves from what we've done, instead of trying to redo what we lost.

He responds be saying how he doesn't see a point to life, and that he has a respect for mother nature and thinks that he thinks it's better to undo humanity and that we refuse to better our impact on the Earth.

I respond by saying as someone who once suffered from depression and better myself from it, I understand how they feel, but don't see a point in being so depressively pessimistic as a result. I then explain how we never intended to damage the Earth, and only really noticed our impact in the last few decades, and that we should try to better ourselves with what we have instead of trying redo what was lost because of us.

His final response accuses me of looking down on him and thinking I was better then he was, and then tells me to leave his page and don't come back.

Now my response back may have been going too far honestly. I respond by saying I tried to help, but he chose to reject it, and instead decided to wallow in his own self-pity, and how I lost any respect I had for him up to that point.

I have since blocked him, and I assume he did the same.

Now I'm torn. I don't know If I was being to hard on him and overly condescending at all, or if my frustration with him is justified. I have difficulties comprehending my actions sometimes, and I feel this may have been one of those moments.

I don't know, am I the a-hole in this situation?

**Edit:** After reading the comments, yeah, I was being a bit of a dick here. Although I honestly was trying to help the guy out, I "
55oync,,"To make a long story short (hopefully) I rent a condo with an attached garage. I live in it with my wife and school aged step kids. Sunday morning I notice the hot water heater is spraying water at the (not appropriately named anymore) drywall behind it which in turn is reflecting off said wall and wetting down the entire garage. This was 8am so it had been spraying overnight for an undetermined amount of time.

I immediately call my land lady who sends a plumber. The plumber fixes it fast and recommends  she have a water damage expert look at it. He comes quickly and assesses the damage using an infrared camera. Because of the age of the home and potential for asbestos, he described the correct by the law process to me (which I verified). He then called my landlady to explain he abatement process and recommended an asbestos licensed contractor to her along with his plan to set up several fans and a dehumidifier to dry it all.

She refused and stated her ""crew"" would handle it and simply rip out the existing drywall and replace. She called me to explain her position and I argued that I was concerned about the lack of drying equipment and potential for mold and mildew. (The garage smells terrible and it wafts throughout the house). I told her I didn't feel her plan was to code or the law. After this her attitude changed and after some berating my knowledge of this and how she is an expert... someone who didn't even give me the correct keys when we leased the place... she stated ""if you don't like how I am going to repair this then you can give me your 30 day notice, move out, and I will cancel your lease.

Her statement struck me as suspect. I ended my call with her and began researching this stuff. She sent a handyman over with a single small fan and he drilled holes into the wall (not legal in this situation) so the fan could dry behind the wall or some such nonsense.

Am I the asshole for insisting she make repairs to code? I am concerned for our health because as"
55qeyu,,"Every day I do the dishes. Sometimes, due to tiredness or a bad day, or just neglect, I don't do the dishes to my step-dad's standards. When this happens, he tends to go on a rant about how dishes are ""the only thing I have to do in this house"" and talks about how easy I have it. I admit, I do have it relatively easy but it's frustrating that he claims that dishes are my  only responsibility.

I currently do the dishes, clean the counters, fold the towels, clean my room, clean the bathroom, clean my hedgehog's cage, and sweep the kitchen, living room, and laundry room. It's not much, but it isn't merely dishes. So am I an asshole for being upset when he says it's the ""only thing I have to do""?"
55snbp,,"This happened awhile ago, but it still eats at me. So some second opinions would be nice.

I met this girl online. We started talking and quickly become friends, eventually evolving into best friends. During the friendship, I never got the opportunity to meet her, all our contact was over the phone/skype/social media/etc. Also during our friendship, a male friend and I were starting to form a relationship. It was exciting, and I would talk to her about it. She always sounded excited for me, too. And she was more than willing to listen to me when boyfriend and I were having problems. She was, in that sense, a great friend.

One day she told me that she had developed romantic feelings for me. She told me she loved me, and was upset that we couldn't be together. I felt bad, I really did. I've been in her shoes with other people and it always sucks. I told her I would stop talking about my boyfriend if it made her uncomfortable. I also made sure to tell her that this wouldn't change how I saw her or our friendship, and that I still considered her my closest friend. All was well for a bit after that.

But then she'd start bringing up her feelings every now and then. Just saying ""I love you"" at random times (times that would be totally appropriate if we were dating, but inappropriate that we weren't), telling me how much she cared about me and going on and on about it. And when she was having a bad day, would say she wished we could kiss and cuddle.

I never once got frustrated with her because she had feelings for me, I got frustrated with her because she wouldn't let it go. It was especially inappropriate because I had a boyfriend that she knew I was very serious about. I offered more than once to give her space if she needed, and she always refused.

So one day I told her that I was the one that needed space, that she was effecting my relationship (he knew about her and what was going on). She was very upset, but said she understood. I told her I still wanted to talk a"
55x7y8,,"I swiped right on a profile because her first picture was really cute and she had a good bio. We wound up matching. I took another look through her pictures and saw that in some of her later pictures, she looked very overweight. Her initial picture wasn't a close-up of her face, she just looked pretty and a healthy weight.

However, I've been on Tinder dates before where their initial pictures were cute and their later pictures weren't, and the later pictures were how they actually looked on the date. In this case, I decided to ask her if she had lost weight since some of the pictures were taken. She said that the pictures were taken over the years and that the glasses may have an effect on her appearance (she was wearing glasses in all her overweight pictures). I asked her if her main picture was her most recent one (because she was very cute in it). She asked me why that mattered. I explained how I've been deceived before, and her response was that it shouldn't matter how made up she is in her pictures and that I'm just projecting insecurities. I then unmatched her, thinking that because she had been so dodgy with her answers, I was right to be cautious.

So, am I the asshole?"
55yzpc,,"I was talking to my friend on Skype (we are both adults) when they mentioned they were reading fanfiction about a particular pairing from a TV show. I said ""ew"", but they thought I meant the show and not the couple. They said they were surprised I didn't like the show because it was so much like another show I love. Our conversation got a little tense over that because I insisted that they were nothing alike.

While that was going on, I looked up the ages of the characters they mentioned, because I was pretty sure one was a young teen and the other was in his 30s. The idea of my friend being into something like that made me very uncomfortable, but I decided I should ignore it. My roommate saw and questioned me about the situation, then sent a message to my friend from their own Skype. (It was nothing more than a ""hi!"", but I asked them not to start shit.)

So my friend got suspicious and asked why my roommate messaged them, and I explained that she saw me looking up the ages of the characters. My friend then explained that there were no official ages of the characters, only speculations. They did admit though that there is likely a decent age gap, and that the wiki pages do say that one is an adult and the other a minor. They then assured me that they like the pairing only in the context of both being consenting adults.

I said ""That's a relief"" but it really upset them and they accused me of being a bad friend for jumping to conclusions and assuming they would be into a pedophilia relationship. I said I was just concerned and surprised, not trying to judge, and explained that ""people are full of surprises"" especially with internet friends and how anyone could be into weird shit. They tried to drop it but then brought it up again by mentioning that I didn't seem happy with them.

I said I didn't like being called a bad friend and they said they didn't like being told they could possibly be into pedophilia. I insisted that I didn't even bring it up, they asked me a q"
