ConvID,Title,OriginalText
2kcn2u,,"When I was little I always had to have my door open. Now that I'm older I want to close it more for privacy. Since I stated closing my door I was told I'm ""shutting her (my mom) out"". Am I an asshole for closing my door?"
2kcqnm,,"I'm terribly sorry this is incredibly long, I just had to get all the details and angles in.

  

My brother lent a few books to my best friend.

  

 My best friend comes from a difficult background and has, in several years past, taken advantage of our trust on a couple situations. I confronted him about these things and he apologized for having done what he did and we (me and my brother) accepted that— and moved on. I've since never had a problem and we have a great relationship. But now 6+ years down the road, my brother lent his books to my friend. (the lending happened 2 months ago.) He now wants them back and says this will be a test for both him and me, (again, I was never involved with the lending) where I am to say: ""my brother wants his books back,"" and then whether or not he tries to pull a fast one and not return one or two will determine if he is ""done with him"" or not. He knows which need to be returned.

  I accepted at first but he would not tell me which books were lent so I could be sure I get them all back because I'm apparently a part of some problem and will evidently somehow assist my friend in the pulling off said fast one. I was not allowed to know whether or not my best friend would betray our trust because I would not only ""let it slide"", but also assist him.


  

I really just could not understand his reasoning for any of this. After a while I got fed up with his accusations and need extreme need to test people so I suggested he just tell my friend the books that need returning, and simply get all his books back. Everyone would be happy, and there would be no chance or need for anyone to be tricked or tested. No need to be so uncertain of anyone.

  It turned out that was too much for him, my arguing against him was ridiculous and unfounded and all these things I told him were flawed. He went on and on... but my brother just starts saying things that are beyond me sometimes. We've never seen eye to eye on most subjects. 


  He's then fi"
2ksqbp,,"A guy I know who is a bit of a d-bag tweeted an insensitive and inappropriate joke about women getting cat called on the street. 

Am I an asshole if I send his tweet to his employer, with some stuff about how they should hire more upstanding and thoughtful people?
"
2ktzse,,"This just happened less than an hour ago, and I'm having a hard time feeling sorry for this one. I was driving back from work (rush hour traffic) when I turned down my street. There were no cars; only three middle-aged-dudes talking to one another on the left sidewalk. I'm exhausted and seeing the open road, decide to speed down my street. Well one of the dudes jeers at me, ""Slow down"" So I do exactly that.. and turn around to confront the group about my driving. I ask them if there was an issue with me speeding down an empty street, and one of them tells me that I need to slow down because there might be children playing right now, and that it's blood on my hands if I run over one of them. I tell him there are no children outside, and basically call him out on (what I perceived as) his self righteous bullshit. Some insults were exchanged before I gave them the finger and went home. Am I the asshole? 

EDIT: As all of this was happening, one of the dudes' car was parked facing the wrong way."
29rh0p,,"I invited my friend to go in a weekend camping trip, along with her son. I was accompanied by my child, and my husband joined us the next day. It was a three hour drive to the campsite, so we stopped along the way to have dinner at my in laws, who live nearby. My friend and her son didn't like the dinner (spaghetti), so I ran to the store to get him mac and cheese. At that time, I asked if she wanted to go with me, since she had told me she needed groceries. She hemmed and hawed and finally said no, we can go later. So, we eat dinner, and then decide to leave asap, since it will be getting dark in a few hours and we wanted to get set up in daylight. At this point I made my fatal error. I forgot to go to the grocery store. Along the way, my friend mentions this...but at this point we are no longer near a grocery store, so I stop at Sheetz, which is a large gas/convenience store. She gets her stuff, we go to the campsite and set up. For the entire weekend she proceeds to complain about not having food, even though my husband stopped at the store and got her food that she requested, as well as the fact that the campout we went to had plenty of food, there was a potluck breakfast, and I went searching for food that she wanted and found it. Still not enough. Might I mention that her son didn't give a crap about the food,  he was only stressed because she was making him stressed, imo.. we didn't speak for a week afterwards, and when we did hang out, she proceeds to tell me how I fucked up her weekend.  I cry, then leave.

Tl;dr I forgot to take my friend to the store, she proceeds to ruin my trip, says its all my fault.

Edit: I had packed lots of food, which she also refused to eat...but she drank our beer and left half bottles of it everywhere. I didn't ask her for any gas money, or money for the campout. She did buy the weed though."
2a16oi,,"So I needed a new monitor and wanted something cheap so I went to good sammys and picked out a monitor that was $25, when I went to the checkout the worker charged me 25 cents, and I didn't correct him at all and left with my purchase, am I an asshole ?"
2a2vii,,"My Side:

     My friends had this fourth of July party planned out at a vacant lot in my neighborhood. My friend (lets call him T) gets off work at 11pm and the party started at around 5pm. we needed a Bluetooth speaker, and someone brought up that T had one, so we went to his house while his parents were there to look for it. his parents were skeptical as to why we were there, but eventually let us in. we couldn't find the speaker so i went downstairs to ask the parents where it was. they said they didn't know and started to ask me some questions about what was happening that night. i was a bit nervous so i filled them in but accidentally told that that T said we could come to his house (he didn't). apparently he told them something different than what i said about the party and they got upset. we quickly left without finding the speaker. later in the night i get a call from T saying he got grounded. he starts screaming saying that it was all my fault. they ground him for the rest of the summer and they say i cant see him forever. i didn't mean for any of that to happen, and T is still blaming me for everything. i tried saying sorry, but he doesn't believe it.

T's Side:

     His best friend goes to his house without asking, lies to his parents, gets him grounded for the whole summer, and doesn't say sorry.

So Reddit, Am I the Asshole?"
2adix7,,"I owed a friend $20 buck from a long time ago. A month later he is moving and I'm in his house and see some shoes that fit me. I say ""I'll give you $20 bucks for those shoes"". He says ""yes"" I give him the $20 and he immediately says ""I would have given them to you for free, I was going to throw them out and remember you still owe me $20 from before"". Now He is pestering me for the $20 from before…I didn't say no but I do feel shitty about it. Am I an asshole for feeling shitty or is he an ass hole for conducting that deal? Also I'd be fine giving the shoes back but he prob wouldn't be down


edit: thanks for helping everyone"
2akaqt,,"First off, my cousin is a dick to my little brother. He's always saying ""man you eat so much,"" or, ""maybe you're just mad because you're hungry,"" in a very condescending way. I'll admit, my brother does eat a bit too much and is overweight. But here's the thing, my cousin is morbidly obese. My guess is 350 pounds. So the other night, we were all having tea. My brother was eating a zebra cake, but he hadn't had one in years, so he was really liking it. But then he saw we had bread, so he put down the zebra cake so he could have bread instead. My sister asks, ""why don't you just eat both?"" And he replies ""Too many calories."" All of a sudden, my cousin says, ""you were just eating a zebra cake, you obviously don't care about calories."" I was mad. The only thing I hate more than hypocrites are racists. I don't remember exactly what I said, but it was something along the lines of ""Shut up about calories when you're talking to him. Look at yourself for once! Jesus!"" Yeah, that seemed to do the trick. He shut up, and didn't say a word for the rest of, the tea time. Then he moped around, acting like I insulted him for no reason. I know you might be thinking, ""maybe he is just looking out for your brother,"" but no. He said it in the same condescending way as usual. Am I the asshole or is he?"
2alsd0,,"Went up to my friend's cabin for the fourth of July with his mom, younger brothers (12 and 14 years old), and a couple of our friends. On the first day we went out to the lake and came back, I dropped my swim trunks, ray bans, and hat off in my room (on the floor, right next to my bed), and went back upstairs to hang out. It should be noted that my room had access to the back yard, but that it was in no way a heavy traffic zone, and yeah, putting them on the ground probably wasn't the best choice.

The ray bans were given to me as a high school graduation gift in 2011 from my grandma. I know they're just sunglasses, but I digress.

Anyway, someone spots a bear in the woods, we're all getting drunk and don't really pay much attention to it, but apparently the little brothers went outside to go talk to the sheriff or something. Cue later that night, I go downstairs to my room completely hammered to find my sunglasses in three separate pieces, mangled, about 3 feet away from where I'd left them. 

The next morning I casually ask the boys if they went downstairs, the classic troublemaker stays completely silent (the 14 year old) and the 12 year old says they did. I then made it clear that I was upset, without getting angry, and asked who stepped on my glasses. It became clear that the 14 year old had. I told him that it wouldn't have been that big of a deal if he had come forward about it, but instead I had to pry it out of him, and in the end, he didn't so much as begin to apologize. Just sat there in silence.

So I ask of you, /r/AmITheAsshole, am I the asshole for asking that he help me pay for a new pair? I feel that at 14 years old he's more than responsible for his own actions, and could find a way to procure *some* money to give (I said $80, they retail for $155), especially after handling the situation so miserably. His older brother, my friend from high school, seemed to be pretty impartial about the whole thing, and I'd feel awkward about going to his parents "
2az53t,,"I posted this in TwoXChromosomes but I think maybe this is a good place for advice too...

My boyfriend (we will call him Rex) and I had been dating almost 2 years. The first year, I was a senior in college and he had graduated a year earlier and co-founded a startup. Of the guys I'd dated, he was the most put-together, the most reliable, the most attractive, the LEAST argumentative (we never ever fought), and I felt had the most potential. At the end of the day though, I felt as if he didn't ""get me"" like my other partners had, but as it was his first real relationship I decided not to give up on this great guy.

Upon graduation, I was offered a job 900 miles away. Rex had his company back home and couldn't leave. I wanted to break it off right then and save myself the pain, but he and his sweet words convinced me we could make it work. Neither of us believes in soulmates so we thought if we put in the work we could make it happen. I moved, he stayed, and our long-distance relationship began.

And by LDR, I mean my chronic loneliness. I am not an outgoing person, I didn't know a single person in the whole state, I walked into my empty apartment crying almost every day, and I clung to Rex for comfort. We alternate turns to take a flight and got to see each other maybe every other month. He truly tried to be there for me, but those happy weekends when he came down would only make me sadder when he left again. He said what he could but I knew my depression was wearing on him and us. At one point he told me just to stop talking about sad things. I knew I had to turn things around, and luckily I was at a company full of young transplants like me, so I began forcing myself to go out on weekends. I flourished. I made friends, got to know the new city, and was finally smiling again. The problem with this new life was that Rex wasn't a part of it. He didn't know the people I talked about and couldn't relate to the culture I was now a part of. I live in an awesome place, and"
2b1kyp,,"I will try to provide as much context as possible to present the story in an unbiased way.

I come from a very conservative Christian family that raised me up through private school with the sole intention of me going to a 4 year college. I have always known that this is not the career path that I wanted to take, but in fear of disappointing them, I never told them and ended up actually attending a semester at a very nice college with the hope that it would grow on me. It only made me even more sure of my decision to quit and go into a field that only requires specific training. My mom was understanding and more supportive than my dad, who has never been the same since. Everything up to this point only serves as contet for the actual altercation. 

I was 18 when this happened. I had been home for a couple of months and searching for a part-time job by my parents' demand. I was sending out dozens of applications, but my complete lack of prior experience was making it difficult to even get a call back. One day my dad gets home from buying pool chemicals and tells me that they had a help wanted sign on the door and for me to apply online for it immediately. I didn't have a problem with this, so I went to the website to check the listing. It was a 21+ management position. Later, he asked me if I applied, and I told him that I was underage and not qualified so I didn't bother. This made him very angry, telling me that I would do what he said and to send in the application anyway. I repeated that I was 18 and have never had a real job before, much less a management position. We argued back and forth with the same thing for a bit and it eventually came to him saying ""I'll just apply for you. Give me your resume and be quiet."" I said ""I don't have one, so you'll be sending in nothing,"" to which he replied ""Don't be a smart ass.""

A little more context to go with the first bit: I had heard my father curse only once before this, and it was after a severe injury, so this marke"
2b1ql0,,"I asked my father yesterday if he could drop me off at a friend's house today. He said ""don't count on it"", and so he meant probably not, but there's a possibility I suppose. I ask him again about it this morning, and he said he couldn't because my mother is going out and is taking the car, and our other car needs to be fixed. I asked my mom about it, and she said that she could just have my dad drop her off, because she's going to a mall to shop with one of her friends, and they're only taking one car anyways so my mom's car would just be sitting at her friend's house all day if she drove there. I told my dad this, and he came up with other reasons why I couldn't go (too busy, have to do this, that, etc). I then asked him why he even told me I couldn't go because my mom was taking the car, and he blew up on me. He said ""This is why I won't let you get your license"" because I argue too much. My mom thought he was also being irrational, but am I wrong?"
2b2co4,,"Back-story: I worked with the male part of this particular couple at a retail store. We had a pretty good friendship, but ultimately, I ended up going above and beyond quite often. I have gotten up after 2 am on a couple of occasions to rescue them because they can't drive (they still do illegally on occasion, hence why I would have to rescue them...one got caught and I have to take the other to jail to bail them out and drive them home). I even let them live with me for a period of time because they got suddenly kicked out of their place. I don't think I have been in a spot where I needed them in any type of emergency situation, but I don't think I hold that against them.

Fast-forward to modern times:

My fiance and I hang with them about once or twice every two months. Not very often. I asked if they would be interested in taking photos for our wedding, to which they gladly agreed. We hadn't talked pricing or anything yet, though I expected it soon. Two months go by and not a word from them. I reach out and we hang again, I bring up the wedding photos again with them. This time they have a ""guesstimate"" number. They say $1000 is normal, but they would only charge me $500.

My friend photographer has yet to graduate from film school and has never shot a wedding before in his life. My fiance and I discuss the offer and decide to try to work it down to $400 instead of $500. We try to set up a time to meet at the venue to discuss photo opportunities. Anytime we are busy, seems to be the times they are wanting to meet up. As if trying to postpone going to the venue. I had to practically beg them to even go in the first place. The female didn't think they should have to go at all.

We are now under a month from our wedding and still no set in stone photographer for our wedding. We decided to check thumbtack. We found a photographer for $400, she set up a time to meet at the venue, sent a contract, and a questionnaire within a few hours of us responding. My friends had "
2b7py5,,"So the SO had recently moved into a new apt. She is trying to make this our home and get me to spend more time there. I am with it. I have been investing time and money into it. And also started bringing some of my things there.

So she has to go away for work for 2 weeks. The plan was that I would spend most of the time there. Still staying at my home for 2 or 3 nights to get to work faster.

So. I get this phone call. Her estranged sister has just been assaulted by her bf. I need to go downstairs and give her mother the keys to the house so her and her son can stay over. I am pissed.

Firstly, this woman has all but avoided her family and kept this kid away for years. Now this person who has been described as irresponsible is now going to be staying in this apt. Unsupervised. With a toddler. For what is supposed to be 3 days (I know it will be longer).

Now AITA because I'm upset that she made this decision without my consultation? Without my input? This dwelling that's supposed to be ours except when it's convenient for it not to be is now once again her house. It wasn't an emergency anymore. This even happened the night before. More than enough time to call me and ask for my input.

It's not that I am put out. I'm just annoyed that she went to save this person who has been less than sisterly to her and has been known to screw up crap alone in ""our"" apt.

Oh and I forgot to mention I was asked by her mother to ""examine"" the sister to see if her nose is broken. Right. On my off time I am now giving medical advice like a doctor that has medical equipment and a degree. (I am a paramedic)

Honest input please?"
2bne2b,,"So i was driving my brother home from the train station and as we were going home i went to make a right turn on a street a few blocks away from my house. Well as im going to make the turn the guy trying to make the left begins to go and then has to force stop after almost hitting me (i have the clear right of way). Well i slammed on my breaks, gave him the finger and called him an asshole (where i live during the summer we get a lot of people coming from other states and they always drive like shit so when i see one of them almost hitting me it really grinds my gears). Well as i go i see him tailgating me, which is fine i didnt really mind. Well as i make the next two turns to go to my house he does the same without even signaling. This leads me to believe hes trying to follow me to my home which i am not cool with. So i pull over next to the house next door to mine and he does the same and we begin to have a verbal altercation. When i confront him about following me he tells me that he actually lives at the house i stopped at (go figure) and, being atleast 40 years older than i, says i should respect him. Well AITA for getting into a verbal altercation with this guy?"
2bnroh,,"Throwaway account because some family members know my main account name on here.  The details in the post should be enough to identify me if they stumble upon this post, but my sister has, in the past, looked up my post history and used it against me.  Anyway,

**Back story**

In 2009, my fiancee and I were renting an apartment when my grandmother went into a rehabilitation facility after a fall.  My family was pretty sure she wouldn't be coming back home, and they asked my fiancee and I to move in.  They told us at this time that we would be renting from them under the terms that:

- They would charge us a rental fee equal to the mortgage amount, no more and no less (so we were basically paying the mortgage but the house wasn't in our name and we can't claim it on our taxes)

- When we were ready to buy, they would sell the house to us at [Market Value - 10% - {however much money we had paid in rent so far}]

- If something ever happened to them, they would leave the house to us in their will.

In 2011, we got married (yay!) and we were going to start saving up to buy the house.  They told us at this point that they realized they couldn't fulfill the terms of the ""MV-10%-paid"" plan they previously suggested, that they would lose too much money.  We would just have to pay market value. ($130k)  We asked the price, they told us, and we balked.  We said it was out of our price range ($80-100k) and we would be looking around.

We contacted a realtor, got preapproved, we were going through a first time homebuyer class that, if completed, would pay our down payment and closing costs (up to $5000) on the house.

Once my mom found out, she got really worried.  She said she wanted us to stay in this house.

A point relevant to the story that is important and complicates matters that I had neglected to mention to this point is that our house is next door to their house.  We share a yard (and we're not really outdoor people so their use of our yard is like 95% to 5% compared "
2brxdw,,"This one happened a couple of days ago. I was in the main shopping street in my town and about halfway down the pedestrianized section,  there's a seating area consisting of big stone blocks for seating. 

Now I am Muslim and I was, at the time, wearing an abaya (long dress), hijab and a faceveil (niqab, which isn't unusual around here). I don't make a habit to wear the face veil all the time but this day I had chosen to do so. 

  I was walking down towards this seating area and when I got there, I decided to take 5min and sit down. To my left there were a group of teenage boys, who I heard making the usual remarks (which I was totally expecting and so ignored). 
   
 After a couple of minutes my attention was drawn back to this group, as I heard two of them discussing whether they should rip my veil off my head, because 'it would be funny'. Then someone else in the group I could hear was asking his friends if they had a lighter, so he could set my headscarf and veil on fire. 

  At this point I really lost it. I marched over to where they were sitting and confronted them, telling them (or more accurately, shouting at them) that not only was I not deaf because I had the niqab on, and so had heard every word they'd said, and that if they tried anything I would personally ensure they would feel pain. 

 Now I feel I may have acted a little asshole-ish, and so I leave it to reddit to decide. "
2btapw,,"I need to move to a new city for school that my sister happens to live in. She and her fiance just bought a house there. They offered me a (small) room in their house for $500 a month (utilities/internet included). On top of that I will have to pay the city for parking and my own groceries. One catch is that I cannot stay on weekends because my sisters fiance has a child from a previous marriage who will be there and they only have the one extra room. I will commute to the city I currently live in and will be able to stay with someone rent free for that  time. It wasn't a huge deal to have to leave since my program is only Mon-Thursday anyways, so I will actually only be living their 4 days a week. 

I looked up 1 bedroom rentals in apt/houses in their neighbourhood and found that with utilities/internet included they run from around 650-750. Some of those even include parking at no extra cost. There is even a whole basement apartment for 900 with all that included as well. Keep in mind that in those cases there would be no requirement to leave. 

will I be the asshole if I suggest I pay less? 500 is still cheaper than what I've found but considering I can't stay. Is it wrong to expect a family discount or would you consider that I am already getting one? "
