ConvID,Title,OriginalText
4czypu,,"Early last month I ordered a sweatshirt with some custom stitching on Etsy. I paid a good amount for it and it was finally delivered last Friday. I was super excited to wear it but, unfortunately, there's a hole in the sleeve.

I messaged the seller that night and let her know that it had arrived damaged. I attached pictures and told her that I would prefer if she sent me a replacement sweatshirt rather than a refund, if that was possible. She messaged me back saying she would get back to me Monday with her decision. Monday rolls around, I don't get a message.

On Tuesday, I send her one more message, asking her what decision she came to. She sends me a rude message telling me she'll ""get to it when she can"" and tells me I just have to be patient. I decide to wait until the end of the week to see if she arrives at a resolution for me. Lo and behold, it's now Friday night and she still hasn't gotten back to me.

Since I ordered almost a month ago, my window to open a case with Etsy is narrowing, so I decided tonight to open a case against the seller since the item came damaged and the seller hasn't been working with me. I think that a week is more than enough time to at least tell me the terms of my refund, especially since I sent her proof of the damage, but now I'm second-guessing myself.

AITA for reporting her to Etsy?"
4d3evq,,I let my boyfriend use my car with him promising to be back by 11 p.m. that night. He was gone for 2 days . I don't care that he was not with me. I'm pissed that he had my car and wouldn't return it for 2 days. I had to use uber to get around. He was fully aware of my Important  things I had to get done...which includes going to work. I also realize it's my fault for even letting him use it in the first place. I'm just so confused as to why he is mad at me for nagging him to bring it back.
4d4npn,,"I'm awful at getting up in the morning, and even worse at remembering to text my girlfriend good morning. 

So I set up tasker to text her one of about twenty different messages at a random time around when I wake up (when I ideally wake up; in practice, I sometimes wake up later.)

She hasn't found out that I'm sending them automatically, because I've only just started the tasker profile (no bugs! Woo!)

I'm aware that it could be construed as assholish behaviour, but hear me out. I'm a chronic sleeper-in, and have so much trouble functioning in the morning. I know that good-morning texts are something that she likes, and I want to fulfil that, but I can't because of how bad I sleep. 

I would argue that it's not done out of laziness or indifference to her emotions, because I was the one that wrote the profile and the entire point of it is to make sure that she is as loved as she deserves (which is lots). I wrote all of the messages, and they fit what I normally would text her in the morning. Stuff like *""good morning beautiful! How did you sleep? xxx""* to make sure she knows I care about her.

It kills me that I don't function well in the morning, and am spotty with my manual good morning texts, which hurts her. This is just my attempt at band-aiding a flaw while I work on developing good sleeping patterns.

If people agree it's an asshole move, I'll stop."
4d8gzm,,"I want the wall, and I want to MAGA.

"
4dcnuy,,"Two weeks ago I've started going to the dentist. Without going into exactly why, I've been told that except for one tooth, all my teeth will have to be pulled. Naturally I'm not thrilled about it. I'm only 28, and in addition to that I've developed bald spots and have been struggling with depression. In addition to that I'm not great around strangers, so going to the dentist is already unpleasant to me (pain not withstanding). After I got my first appointment I messaged my dentist over viber to confirm the date and time. She is my age and seemed rather friendly. We talked for a bit after that about random things and joked around. I knew she was married and I personally didn't find her attractive even though objectively I consider her pretty. I made some (in hindsight) possibly inappropriate jokes, but she didn't react negatively at the time. In fact, the next day she told me how much she had to hold back not to laugh too loud and wake her infant daughter. We talked maybe once or twice after that, but not nearly as long. Fast forward a few days later, I'm in the waiting room. She opens the door and tells me to come inside. As I step in I see a guy standing in the room. I'm thinking he's leaving as I'm going in and don't think much about it. I start taking my jacket off and the guy sits down (There's chairs for when she's taking a break in the room, it's separate from the waiting room). Already I'm confused. She tells me to lay down on the weirdly shaped dentist  hair. A thousand thoughts rush through my head. ""What is she doing? Is she gonna pull my teeth in front of that random stranger?"" I'm not feeling comfortable at all about this, but she just casually gives me the anesthetic. As soon as she's done injecting it she starts talking with the guy. I turn around and see him reading patients files. She tells him not to do that,  while smiling and giggling. He just looks at her and smiles back. I'm completely lost and raging inside. She walks back to me and pulls a too"
4diwg3,,"I live in Canada, and I always thought a 15% tip was the standard, normal rate of tip. I tip 15% for mostly everything - restaurants, hairdressers, taxis, nail salon, my tattoo artist. I have rarely, if ever, tipped more than 15%. If I order something for takeout and I'm just picking it up I'll tip 10%. If I'm just grabbing a coffee I'll put my spare change in the tip jar and I tip about $1 per beer at a pub. We Canadians are pretty polite, so even if I got pretty bad service I would still tip 15% (rarely has that happened to me). Recently I was having a conversation with some of my friends and they said that tipping 18% is actually what is considered normal, and 20% for exceptional service. They said 15% was not that great, bordering on rude. Is this true? If so, it's seems like tipping is getting pretty expensive, but perhaps I just need to think of my bill with an extra 18% when I'm thinking about how much I should spend at a restaurant. Am I the asshole for not wanting to tip more than 15%?"
4dmcav,,"I'm a college student who was recently assigned group work for a law-based class. I missed the first meeting of the group (Due to being hospitalized), and came back to chaos. One girl appointed herself leader and then proceeded to do no leading. One girl is going on vacation and is forcing everyone to do the project three weeks early because she's deciding to go on vacation, and then two guys who are actually doing the work.

The biggest AITA came this morning when I started to write up my info. I went online and looked at the documents and realized that, thanks to our ""leader"", we have been focusing on the wrong case for a little over a week now. 

Since I got into this group, I have had to unfuck the leader's lazy delegation, organize group meetings, and apparently realize that we would have failed if we had presented the wrong case in class. Am I the asshole in this situation? I'll answer any background questions in the comments."
4dp5aw,,"By the way, I know I am bias as hell towards my mother. My father and I don't get along that well. 

First of all, my father is in his early 60s and is an avid bicyclist. He's been in this hobby for about 7 years, give or take, after some family issues. However, my mother and I believe that it has taken over his like,I mean, like, addiction levels. 

He has spent thousands of dollars on this hobby and has invested himself into the local government with it. He aims to ride hundreds of miles a month and it has reached the level where my mother and I don't think anything of him riding 70 miles. While I am annoyed in general about all the talk of it, he's always on the equivalent of bike-facebook and gets upset about likes and shit, I kinda don't overly care. Or at least I stopped when I moved out 5 years ago.

However, my mother has always had issues with it. She was happy and supportive at first, but this has declined. She has been angry and upset and hurt by the bike over the last few years. This is due to massive expense, the amount of times he's been hurt by it -twice before this, both times hospitalized. The first time he broke his back and went back to riding and the second time he destroyed his fingers and went back to it -and no 17 year old wants to get a call from the cops that their father was in an accident. 

Anyway, she is also hurt because of the fact that he has neglected the rest of his life. His schedule revolves around the bike, and I'm not kidding. He plans around the rides he wants, has maintenance hours, and does a lot of shit. The problem is that it's in excess, he rides multiple times a week, not including to and from work. 

Because of this, he has neglected the house, badly. They have a pool, and it is basically a swamp. The house needed a lot of maintenance for a while, due to damage from a storm, and the house was left missing infrastructure for about 2/3 years. Apperently, whenever my mom tried to fix it, my dad would get upset that she was "
4dqv6w,,"So my boyfriend has a habit of just opening messages, seeing them and just not replying. I have social anxiety and it made me really uncomfortable messaging him so today I just asked him to please not do it anymore. But now I feel like an asshole because I feel like he feels pressured to reply to me all the time when I don't want him to feel that way. Am I an asshole for making him feel bad?"
4dswx1,,"I am incredibly ""uninformed"" because I have never looked at any news for most of my life. Anytime someone starts talking about politics of any kind, I make sure I either back away from the conversation or tune out completely. I just don't know why you would waste your time even thinking about that shit. I am glad to say that I have NO idea who is running for president or congressman or whatever the fuck. It's just PATHETIC to me. Am I the only person in the universe who feels this way? because I'm starting to feel like I am.
___
Edit: I know this isn't a personal conflict between parties A and B but i had no idea what sub to post this on, so don't remove it because I already had to wait 10 fucking minutes to repost it after I apparently formated the title wrong."
4dsxyk,,"AITA. So I driving down a road one day and a person cuts me off and gets in front of me. This person then proceeds to pull over to the right of the road. It's a big enough road, so I think he's stopping and decide to start passing him on the left. Well this person has in fact decided to make an illegal u turn from the right side of the street without a turn signal or anything forewarning. Which results in me hitting him in the back side of his driver side. Please tell me am I the asshole or is the person making the illegal u turn? Is there any other place on reddit I could get advice from?"
4dtnx6,,"Hi all, I need to know if I'm the asshole.

I am looking for a simple slab of wood that I can use a desktop when placed upon some sort of support (ex. filing cabinets). In early March I contacted a freelance woodworker on Craigslist who said that they could make a desktop to match my specifications (6' x 18'"" x 1""). This is what happened:

-I very explicitly stated that before moving forward, I wanted to know how much the piece of wood would cost. They said, ""It kinda of depends on how long it will take to sand it down. As it is now $60."" They asked me if I wanted a gloss coat, and I said yes. They said it would be ready in early April.

-I contacted them today asking how the progress was going and they said it would be ready by Monday. I asked them how much the total cost would be. Given the only amount of money they had disclosed to me cost-wise was $60, I assumed it wouldn't deviate too much from that. Instead, they were asking for $300 (all for a 6' x 18'"" x 1"" piece of wood). 

-I said: ""I see. You said in an earlier message that it would be around $60-$100. If you look at the initial messages I sent you on March 10th, you stated that. Was there something I missed?""

-They said: ""I said 60 for the 6 by 18 as it was, Without any work put into it. Then I asked if you wanted it sanded and glossed it would all depend on how many hours was put into it and the quality of the finished product. If you buy any type of wood for furniture and it is a finished product it will be pricey not to mention custom made.""

-I said: ""Clearly I have never  bought anything of this sort before, I feel like an idiot. It would have been nice to have had a final price estimate based upon what I asked for, but that was my fault for not being explicit.""

-They said: ""I wouldn't have been able to give you an accurate price because I didn't know how much work needed to be put into it.""

-It went back and forth like this, and I argued that they should have been straightforward with their pric"
4dy1f9,,"So about six or 7 years ago I decided to take over cooking and shopping duties for my household of 5.  Long before I took over, and for a few years after, the grocery store had your [traditional style checkout stands]( http://i.imgur.com/zpUTnLW.jpg) where the cashier would take your items from the first conveyor (which you typically loaded yourself), scan them, then place them on a second conveyer that would go to a bagger at the end of the stand who would then load your cart.  Practically every lane with the exception of the express lanes was set up like this.  

A couple of years back the grocery store took out the old stands and replaced them with these updated ones that removed the traditional bagger’s area and replaced them with the carousel-style bagging system you typically see at [self-checkouts]( http://i.imgur.com/cx29l8J.jpg).  I suppose you could describe it as a [hybrid of the two stands]( http://i.imgur.com/wgiNaWm.jpg), and though no one comes right out to say it, the intent seems clear to me; They want you to bag your own groceries.  

There are maybe 1-2 baggers/runners on shift at the time and day I go, when there used to be about one to every lane.  When they were first installed, it was a nightmare.  Lines were stacked up further back than I had ever seen, customers were upset with the new system and many were not afraid to complain to any employee that would listen.  In the time since they were first installed it has gotten a little bit better, though not as fast as it was before, and I am still not having it. 

 I don’t mind loading my own cart, but I am not going to stand there and bag the groceries when there are plenty of other grocery stores in the area (even ones owned and operated by the same company) that don’t have these new stands.   Every time I shop I play a waiting game with the cashier; who is going to flinch first and start bagging the groceries?  Not I.  I look over to the next lane and see some little old lady bagging her own g"
4dyx18,,"I am a part time nanny/babysitter/housesitter for a family and I have been working for them for almost a year now. The kids are very well behaved and pretty much do everything I ask and I have never had any issue with them. 

It was recently my birthday and I babysat a few days later and the mother (who is friends/acquaintances with my mother and must have seen that it  was my birthday on Facebook) gave me a sealed birthday card before she left, and I opened it after and it had a nice card signed by the kids and a generous amount of cash inside. When they got back they paid me and I thanked them again for the card but didn't mention the cash because I wasn't sure what to say. Now I'm paranoid they thought I was ungrateful for either not opening the card in front of them or for not thanking them directly for the cash. I am sitting again tomorrow night. Should I mention it again? Am I the asshole for not opening the card in front of them? I was extremely grateful for the money because I am finishing up college and applying to med school this June and cash is tight. Should I write a thank you card?

Sorry for any typos, I'm using mobile right now"
4e22v5,,"It was my 18th birthday last week and my parents decided to throw a party tonight to celebrate with all of my extended family. They asked me if I wanted it a couple of weeks ago and I said no because I dont like being the centre of attention and the fact that it was going to be hosted in a pub. I said that I would much prefer just going out for a nice meal instead. However, they completely disregarded what I said and went along with it anyway without considering if I wanted it or not. They asked me if I was looking forward to it a couple of days ago and I said no and a big row erupted in the house. 

So tonight I'm forced to go to a party for me that I didn't really want and Ill be stuck talking to family members I have nothing in common with about boring stuff in a pub while eating cold buffet food. I appreciate the thought they put into the night and I told them this but they completely disregarded how I felt about it. So reddit, am I the asshole?"
4e30xv,,"Today a truck arrived with literally tonnes of soil to level out the garden. It got dumped outside the house at about 10am and it took my SO and his parents all day to move it.

I didn't help because we have a 7 month old and someone has to look after her. I felt bad just being on my phone when she was napping but I had no idea when she would wake up and if I had been outside I'd have been covered in mud and would not have heard her cry.

Also worth noting is that I had no idea this would be happening; my in-laws arranged this. I greatly appreciate what they're doing for the garden, but they also enjoy doing it; my SO and I never asked them to do it.

My FIL keeps making passive-aggressive comments insinuating that I'm lazy. My MIL is too polite to say anything but am I? Am I the asshole here for not offering to help?

Edit: I did make dinner, cups of tea etc.  for everyone."
4e3tjy,,"I'll try and keep it short, but at the same time I know you guys here like to pick out every detail that makes the OP appear to be the asshole before you fully judge the situation. That is the extent of me being an asshole in this post. I hope you'll agree.

Last week I was invited to an event, a dance, by my ex's roommate. I broke up with my ex two months ago after about a month of fighting about me being insensitive and her being too sensitive. On top of that she wouldn't really participate with me in the things I thought interested us anymore. This was all exacerbated by my leaving the country and her having pregnancy scare. Regardless, we break up because I thought she didn't care much anymore. But she cried so immediately I regretted it.

A week after that we go out for coffee and I tell her I want to get back together. She tells me we need time and not to get my hopes up. I don't give it time. The amount of fury in my head forces me to start an argument. And so a relatively civil break up turns into a post break up fight. As per usual with me. We aren't friends, we don't really talk. There's a major coldness between us that I now wish wasn't there. I asked if we had a chance and she said she didn't think there were romantic feelings between us anymore. I told her I wanted to reconcile the friendship. I understand how she doesn't believe me.


So the question is this. It's been two months since we broke up and I'm seeing someone new. The new girl knows the situation completely. My ex isn't seeing anyone of course. She's a very innocent girl I think and she won't date someone she doesn't have an extreme connection with. I invite the new girl to the dance and honestly I wasn't expecting my ex to be there but I knew it was possible. 

She shows up. I didn't totally expect her to. Like I said one of the reasons we broke up is that she would never get out with me. We even dance. She's says something critical about me. I try to be normal with minimal success because "
4e4jvg,,"OK, so the story is this:

My aunt and I have had an argument over the past few days about a situation where guests will be staying with me in the house. A bit of context: I live downstairs in a studio-style flat - so basically bedroom and living room all in one. I pay my aunt money to stay there, and it's always been assumed that whole space is mine (by all parties involved in this) because I pay board for it and it is completely separate from the rest of the house.

Now, up until a few days ago, this situation was fine. Then she springs onto me that I will need to have guests staying with me mid-week and will be setting up a bed downstairs in my living room. I work full-time and I'm usually out of the house by 7am.

I say 'no', because of this. Her response was 'well, too bad, I'm putting the bed down there regardless of whatever you say'. Never mind that I would have been fine with it if it was on the weekend.

Fast forward to yesterday. I return home to find that my entire flat had been rearranged, *which I had locked up before leaving*, to have a bed smack-bang in the middle of the living room.

We had quite an argument about this. Some nasty things were said on both sides. She threatened me with eviction just because I wouldn't bow on this matter, and used the line 'This is my house, it's my rules, you will do this, whether you like it or not'. In the past if we had extra guests they would stay in the dining room in the main part of the house, but this situation has changed for some reason. She used examples like 'well, you listen to music at 1am (which I haven't done in weeks), so I'm sure it's fine'.

Unfortunately, I had to say 'yes' in the end, and I'm less than happy about it, because her partner, who actually owns the place, put his foot down and said 'My roof, my rules, and I say you let them stay down there, and it'll be like this from now on - I might have people stay down there from time to time and there's nothing you can do about it'.

So, guys, am"
4eamp4,,"I am in college in the Eastern US and my friend Jed's mom is in town (she's a really cool woman). My friend, his mom, a few more of our friends, and I go to dinner at a local restaurant downtown. At night, the restaurant is a bar, but we get to the restaurant around six pm. 

We are having a nice meal in the side annex of the restaurant surrounded by a few other tables (mostly families), but off in a corner is a group of around five 60 something year olds and they are absolutely blitzed. They are screaming and yelling and laughing at the top of their lungs, and I can barely hear my friends or Jed's mom whom I haven't seen in a few months. After about a half an hour, one of them (codename Ruth) comes over to our table unsolicited and drunkenly says something along the lines of 

""I know we're yelling and making a scene over there, and we're sorry, but we aren't going to stop.""

 Everyone at my table seems to think drunken Ruth is hilarious and instantly forgets the fact that we can barely hear each other over the raucous seniors and tell her not to worry about it, at which point I interject and point out that her group is being inappropriately drunk in a family setting. My group laughs it off and Ruth leaves, but whenever I see Jed's mom, she loves giving me crap for ""yelling at an old lady"".

All of my friends think I am an asshole for this. So does my own mom!

Am I the asshole?

EDIT: Broke up paragraphs"
4ebmcl,,"She called me and broke up with me at work with no real explanation, so once she started posting pics with her new BF I deleted her. I don't want to see that and I told her so. Now she's making it seem that I'm the asshole."
4ec2jc,,"So on the 9th it was my brothers 18th birthday he received £326 pound in gifts and will shortly be getting a new car, although it is mine on the thirteenth (i will be turning 14) so i casually brought it up to my parents, and they snidely replied
""oh you wont even get £100"" and instantly i said 
""but thats not fair i need at least £200 for new clothes"" and then they started calling me greedy and a horrible child and i would like to know if i was out of line or if they were being unfair."
4edup0,,"So this story starts out when I was sitting down in class when we got new seats. Well I got placed next to a kid I've never talked to before. Well for about a week he makes filthy Franck impressions and beat boxes (there not very good either).  So I ask him to stop because it's very loud and distracting he tells me no. This kinda pissed me off a lot so I do this thing where whenever he tries to talk to me I just say ""yeah dude"" and ""yeah man cool"" so after about a week of doing this he asked me to stop so I say no, then he gets up says ""I'm gonna punch you in your fucking face I swear"" and then gets all up in my face. So I put my hand on his chest and tell him to back off he says ""fuck you"" I ask him another time and says the same thing. So then I feel very threatened so I  punch him in his face and he goes down and then we both got sent to the office and get suspended. 

Now I apologized to him and I think we're cool now but I still feel like I'm in the wrong. Am I?"
