ConvID,Title,OriginalText
4yg17j,,"My husband and I paid for my son's expensive smartphone a year ago. He is a college student who just finished his junior year. This summer instead of working at a local store - where he's worked every summer and break during college, he went to another state and worked for a couple of months. He came home with a month left before he goes back to college and while he can work at the store for a month doesn't want to. On his way home from out of state he dropped his phone in water and it appears to be unfixable. I think he should pay for his own phone if he wants to replace it. He thinks we should pay since he needs it and is still in college. I think he should use the money he earned, or even better , go make some more. He CAN work at the store even if it's for a month. AITA for not wanting to spend a cent on a new phone for him?

Edit: thank you for the feedback and confirming my view!! It's on him. I think that by the time he leaves to school, he'll buy one himself because he totally relies on it for his social life. "
4yh519,,"Okay, so this is kinda convoluted so bear with me.

My best friend (Kelly) confided in me that our other friend (Anne) was in an abusive relationship. One day, the three of us got talking and Anne mentioned she had plans to run away with said abusive boyfriend. I expressed my concerns about this, stating that I care about her and this wasn't a good position for her to put herself in. Both Anne and Kelly got mad at me but Kelly was even more mad because she was the one who told me about Anne's situation, not Anne herself. 

Kelly ended up telling my boyfriend, Trent, about the situation and he asked me about it. I told him that I would deal with it and I was wanting to talk to Anne alone and explain where I was coming from. I asked him to let me handle it, because it's not his place. 

Trent ended up texting Anne anyway, which resulted in Anne being even more pissed at me. I told him I wanted to see the conversation, because I feel I should know what he said about me, and what upset Anne even more than what I had done. Trent  basically said that it wasn't my business, even though I think it sort of is. I told him again that I would like to know what he'd said and he responded with, 

""Is there anything else you'd like to know, perhaps my bank information or my social security number?""

I told him to fuck himself because that was super hostile and (in my, possibly wrong, opinion) uncalled for. 

\\
My questions for reddit are basically 

1. Am I an asshole for expressing concern for a friend based on information I technically wasn't supposed to know?

2. Am I an asshole for wanting to know exactly what he said to upset her further, especially since it involves his personal interpretation of my words and intentions?

3. Am I an asshole for reacting to what I thought was blatant rudenes with more rudeness?


 Thanks reddit!



Edit: a word "
4yma6o,,"This is probably going to be rather emotional but I'll try my best to not make it onesided. Here's my backstory on this whole mess, for context. Tl;dr at the end of the backstory.

I've lived alternatively between my mom and stepdad, and my dad and stepmom for my whole life. I'm currently 19, living at home to save up money before I move out this fall.

Ever since I was about 9, my stepdad and I have had issues. Before me, he was very hostile toward my older sister, who was a young teen at the time. I vividly remember him getting in her face, absolutely screaming, before slamming her laptop down, bruising her fingers. This was a regular thing, he would get in our faces and just scream at us frequently.

We chose to live with my mom more often because my dad and stepmother were alcoholics who hardly had food for us. So some screaming seemed okay in exchange for regular food.

When I turned a bit older, about 13, I was dealing with a lot of depression and an undiagnosed personality disorder, so at 13 I tried to kill myself. We were supposed to visit my stepdad's family the next day(it was around christmas time) and when I woke after my failed attempt, I just locked my door and refused to go to the family event. My family didn't know what I'd attempted. They came in and we argued for a while before my stepdad forcefully grabbed me and dragged me through the house and threw me into his car. It doesn't seem like a big event but I still haven't fully gotten over it. I think it's the main reason I'm terrified of large men to this day.

During the argument I revealed what I'd tried, so after my stepdad threw me into his car my mom said her and I were staying home, and that she was taking me to a mental hospital.

So my stepdad leaves, my mom goes into my room to throw away sharp objects as the mental hospital employee told her. I called 911 while she did this and told the local police officer I was transferred to that I didn't feel safe in my home, and told her about my ste"
4ymdyk,,"Long story short, I wronged an ex-friend of mine a long time ago over a sleeping with a guy I didn't know she was interested in before she and my friend moved away, which I desperately apologized for (even though I'm certain she was wrong, she denies it being important anymore but still thinks I'm a negative influence in her life.) So this ex-friend and another friend live in an apartment together with 2 other people, and I let my friend borrow $300 to afford rent after she quit her job over a coworker sexually harassing her. Fast forward 3 months from then, I'm supposed to visit my friend (I live in another state) and my ex-friend thinks I'm too ""untrustworthy"" and that I'll sabotage her life and she doesn't want me to go through her stuff while she's gone that weekend... so my friend says that I have to rent a hotel, and that I can't stay the night. So I help them keep their place, and I can't be trusted to stay there even though my ex-friend was gone that weekend? I told my friend I was incredibly hurt by this and I decided not to visit, and she never replied. Am I the asshole? 

Edit: My friend still hasn't paid me back, and won't respond to my texts. "
4ysp8y,,"Ok so we recently made a 10 man league, we are all friends. The problem is three of the people don't know anything about football. One of them named J had tom brady and David Johnson in our ppr league. I traded dalton for brady and it was accepted. Then later today my friend H who's good at fantasy trades to J dwyane allen a decent tight end for David Johnson. In a PPR league johnson is way better than a tigh end especially an ok one. So i try and get the vote vetoed because its clearly taking advantage f J, but the commissioner named Z is torn. I then get into an argument with H about how he didnt know what he was doing and H tried to claim I did the same with Dalton for Brady. Am I the asshole for apparently doing the same or is he for taking advantage of a new person. "
4yt0vh,,"So my GF (23/f) and I (23/m) have been fighting all day about this. She went over a friend's (22/m) house to watch wrestling while I was at work. Normally I'm cool about it, her best friend is a guy. Anyway she hungout there for awhile and they always text and whatnot but a few weeks ago, she told me that he got drunk and said he ""should've fucked her in high school so he'd have bragging rights since she is hot now"". I for one got livid and told her I didn't like her hanging around him, but she still went last night and today I asked her to stop all contact with him. AITA?"
4yuxam,,"Yesterday I said to my Mom that I would go out on Sunday with a friend of mine, I said I am not too sure on the time because that is a subject that can change, but I still told her that I don't know when I'll go out.


Today at 4:25 PM I get a text from my aunt : "" at 5 PM I'll pick you up, we're going to eat out sushi!""

I told her that I said I have plans and not sure if I would go out, she said my mom said it was okay for me to go out. Mom comes home and I tell her what the hell is going on cause I said I'm most likely not available today.


She starts calling me a cunt for being rude because I didn't say a specific time, and it's ""more than likely my friend will bail on me either way"", eventually I went out to eat Sushi and NOT miss out hanging out with my bud, but who was at fault here?"
4ywc0a,,"My mother is like most mothers, she tries to force feed us at every opportunity then guilts us about how we're not grateful enough for all she does for us. Standard fare. We're visiting with my sister right now as Sister wants to spend time with my daughter. 

Tonight Mother came in from sofa shopping with Sister and was ravenous. Mother likes to eat lots of small meals throughout the day and hadn't eaten in probably 4 hours at this point. Mother cooks while I take care of Daughter. Sister helps Mother cook at the beginning but ends up just hanging out in her room. Mother takes her meal into the lounge to watch TV while she eats and tells me to leave Daughter with her while I get mine. I don't see the point in bothering her with Daughter so take Daughter with me into kitchen to get my food. Sister is already in kitchen and serving herself. I wait until she's done then grab a plate and start serving myself, all with Daughter on my hip. Sister asks why Daughter isn't in lounge, I tell her I didn't see the point in hassling Mother. Sister tells me not to serve myself because the pans are hot and I'm going to burn Daughter. She is very snarky about it. 

I wasn't hungry to begin with and didn't ask for this meal but was going to eat it to keep Mother happy, as I usually would. I don't see any reason to put up with Sister's shittiness and sit eating a meal I don't want while I am now sobbing. 

I take Daughter and myself into the spare room where we are sleeping and play with her some more. Mother is very unhappy that I'm not eating the meal but I really am sick of engaging in negative behaviour all the fucking time and while I'm used to and willing to put up with my mother I don't think I should have to pander to my sister as well. 

After Mother finishes her meal she follows me round and physically removes my daughter from me trying to make me eat while in trying to get my daughter ready for bed. This only upsets me further and I eventually stop responding to mother wh"
4yxhzl,,"Recently a roommate and I moved into an apartment complex built in the 1970s.  It isn't the most modern unit, and living noises are somewhat of a given.  I generally try to keep a pretty cordial attitude with our neighbors, but our downstairs neighbor in particular has started to concern me with noise complaints.

The first two times they came to me personally and complained of noises late at night.  I complied and was happy that they had notified me that I was disturbing their sleep by being out late at night.  No more after midnight sitting on the porch, I could do that.

The second time was again out on the porch and I had fallen asleep in a lawn chair.  I was a bit groggy and my leg was a bit numb and I fell down.  The next day she came to me and complained that the noise had woken her up.  I complied again and made a point to not be out after 10pm anymore but instead to retire to my room and avoid walking around the apartment.

Today at 4:30 I was doing some laundry and my roommate was out on the balcony having a beer and enjoying the nice weather.  I came back and he looked rather upset and told me that she had come to him and began to yell and curse at him for the noise my hamper was making rolling across the carpet.

I'm stressed to the point of exhaustion trying everything to be quiet and respectful.  I've apologized profusely and tried to do better, but this one has me shaking my head in frustration.  I don't think it's unreasonable to expect normal living noises during the daytime and it's not as though we're banging against the walls or cranking music up late at night.  

I understand the late at night noises being an issue and I'm more than happy to comply by keeping to our respective rooms past 10 at night, but yelling and cursing at my roommate for noise made during the afternoon hours seems a bit excessive.  Are we being the assholes here?"
4yxoax,,So I am now a senior in high school and my dad no longer wants to drive me 30 minutes everyday to the private school he's making me go to. He tells me I need to get my license and accept responsibility for myself now because I am an adult. He says I should be driving just like everyone else my age is and he shouldn't be driving a 17 year old around anymore... I told him I don't like driving as it makes me very anxious and nervous and tense (probably because of the bad car accidents i was in when i was a kid) and it also makes me very on edge for the rest of the day. I've practiced driving a bunch but i really hate doing it. I'd much rather just take a bus or walk but sadly there's no way to do that in this case scenario. I'm not sure what else to say so if there's any other info needed feel free to ask and i'll answer your questions.
4z2f7l,,"&gt;https://www.reddit.com/r/WatchItForThePlot/comments/4z0blo/mila_kunis_cheerleader_plot_on_that_70s_show/d6s4xyx

Guy pulls the whole ""it's not pedophilia, it's hebephilia"" bullshit on a post of Mila Kunis when she was underage. I point out that it's still pedophilia and get downvoted to hell. Guy gets super hostile and gets upvoted.

Not sure what I'm missing here."
4z3quo,,"This story needs a little setup, so bear with me. My cousin and I shared a dorm with two of the worst roommates imaginable last year. Constant partying and loud music in the middle of the night at least 4 days a week. The other 3 they were just generally loud. When it's finally time to move into a new apartment my cousin and I picked out a two person and everything was great until today.

He walked in about an hour ago with his two friends, both generally cool people. The problem that I had is that they were being essentially the same as the original bad roommates mentioned. I would have thought that dealing with this from the other situation would prevent issues like this, but I guess not. Anyway, I was trying to sleep and that didn't last long. Neither did programming after I jumped on that. We both pay equal rent, so it's neither person has more fiscal control than the other. I was just wondering if I would be in the wrong bringing this up as an issue and asking him to ask me before having people over. I mean, yeah it's his house, but it's just as much my house.

I really don't want to be rude or ruin this thing we've got going, but I also want to be able to sleep or work whenever I want in an apartment I'm paying several hundred dollars a month to have."
4zbpos,,"[Here's the thread.](https://www.reddit.com/r/NewTubers/comments/4z5fku/i_made_a_back_to_school_advice_video_for_high/d6t0dqw)

I submitted a post to /r/Newtubers posting a video I made on my Youtube channel. Up until last week, self plug posts were acceptable, but they recently changed that in the last week unbeknownst to me. For the record, the rules on that sub have changed at least 3 times in the past month, sometimes I don't realize they've changed.

Upon asking the mod that removed the post why it was removed, he told me to go read the rules. I did re-read them but didn't see a rule indicating why my post wasn't allowed and still wanted clarification as to why it was removed so I don't make the same mistake in the future... And it escalated from there, for no good reason imo.

After my lengthy final reply, he subsequently [game me a temporary ban/time out](http://imgur.com/a/SLl7C) to which he's escalated it to a [lengthier ban](http://imgur.com/a/1VovB) still insisting that i'm being rude and out of line.

Maybe i'm not seeing it, but i'm having a hard time understanding why i'm being unreasonable/the asshole? I asked him what rule I broke when posting and he wouldn't tell me, instead he told me that's my job to find out... When I tried to find out but couldn't see I asked for further clarification and he jumped and told me he's not my servant. I think he's the asshole, but maybe it's me? I'm not sure. I did make a jab telling him he's giving me attitude, but it looks like he took that jab and impaled me in return. I thought mods jobs were to be of help and answer your questions, but I didn't get that at all from him. And he tells me i'm overly sensitive, but bans me and tells me i'm being 'quite rude' to him when the whole time i've just been wanting clarification.

Reddit, who's the asshole?? 

Edit: [I've now been banned for 72 hours. Still no clarification given. Is this warranted?](http://imgur.com/a/W6s8s)"
4zfg71,,"I was having a conversation with my friend last night, and they kept on replying with ""ok"" to my messages. I was thinking it was a little odd at first, but then their last message to me was sent in what I perceived as an angry tone.

After their last message, I immediately see a notification from another app which has a group chat with the said friend. They basically said: ""Have you been uninterested in someone's conversation that you keep replying with 'ok'?"". 

Upon seeing I assume it was me the friend was talking about, as they had posted there straight after they sent their last message to me. But then my rational mind says 'What if?' it was someone else. But then I was thinking it was unlikely, so I decided to leave it for the time being.

Then I get another message from that friend in what sounds like an angry tone, and I'm thinking they must be in a bad mood or something. I was conflicted on whether to talk to the person about it, but the last message from them kinda set me off. So I send screenshots of the other group chat to my friend, and then basically assume (maybe I shouldn't have?) that they are talking about me. And my friend denies it, and tells me to ""fuck off"", and starts calling me an asshole (literally).

reddit, am I being the asshole here for assuming/thinking my friend was talking about me behind my back?

EDIT: I should probably mention this is my closest friend I'm talking about."
4zkc17,,"So school started up last week on Wednesday and I'm taking algebra 2. I haven't done taken math in about a year so it's taking a little while to get back into the groove. Anyways there has been 3 pages of homework so far and I haven't gotten them done in time. Today the teacher gets in front of the class and says ""we have a winner, congrats to bob (me) for being here everyday this quarter and doing absolutely nothing in class."" Of course the entire class is staring at me at this point and I didn't really have anything to say. Pretty embarrassing. So am I the asshole?"
4zklza,,"I received an e-invite to a get together with coworkers in a few weeks.  It sounds fun, I reply that I'll be attending.  

Yesterday, the host of the get together informs me that another coworker cannot make it on the specified date and asks if I'll be able to attend a new event, which is now on Friday.  

This other coworker apparently threw something of a fit because she will be out of town during the time of the originally proposed get together. Upon hearing this information, I say that i need to check my calendar because I'm not sure I can make it.  My coworker is constantly pulling shit like this and it made me angry to hear she'd forced the host of the event completely rescheduled due to her own conflict.  

Today, another coworker asks if I'm going.  The event is tomorrow.  I say no, that I have other plans, to which I'm called ""anti-social"" by several of them.  I shrug and let the comment be.  

So, am I the asshole for telling a white lie and not attending the event tomorrow? 
"
4zov6v,,"I work at a charity shop, so it's unpaid volunteer work, every weekend and some weekdays (when they need me). I've already told them I can't work next Saturday because I'm moving and need to go sort shit out on that day and they said it was fine. Now I've hardly been able to see my boyfriend over the summer for various reasons and this Sunday we're both free and I have the house to myself, only problem being, I'm scheduled to work that day. I know that they'll be fine without me and there are other volunteers, but I definitely don't feel comfortable telling them that's why I don't want to work that day. AITA if I lie about why I can't go in? Or rather, how much of an asshole am I?"
4zxql1,,"Today, I'm supposed to pick up someone from the train station in the afternoon. My friend, let's call him Chris, has asked me to send him to the bus station, which is a few minutes away from the train station, to buy a bus ticket. Problem is, I don't want to. My feelings towards Chris has been iffy for a while. In my circle of friends, I'm the only one who has a car so we always carpool together only when we have the same destination. Everything is located nearby so my other friends usually cycle to places like the bank, laundromat, post office etc. but not Chris, he calls me up and asks me to send him there because he doesn't like the heat when he cycles. There was an instance where my other friends all collected some cash and gave it to me as petrol money, since I had been driving them around for around three months. I refused at first but accepted it in the end. I found out from my friend that Chris had pulled him aside and said ""What? Did you guys seriously pay MSkyDragons? She said it was fine."" He only chipped in after being lectured by my other friends. Sometimes when I'm already eating at a restaurant with friends, he'll call me to pick him up from his place just so he can join us. After this, I've been reluctant to drive him anywhere, like the bus station, even if I would've readily done the same for any of my other friends. I sometimes feel like we're only friends so that he can sit in my car. Am I the asshole?

EDIT : Just an update, when I told him that I couldn't send him to the bus station, he said it was fine and that he had another friend who could send him anyway. Then why ask me, wtf???"
5000pc,,"Last summer a friend of mine, lets call him Peter, was in a jam money-wise. I offered to borrow him money to which he agreed, but not before telling me that he didn't know how long it would take for him to pay me back. I said that was okay and proceeded to lend him the money.  
  
Fast forward about 4 months, I'm in a conversation with Peter and our mutual friends when he tells us about this new PC he's bought. It registers with me, but I think nothing more of it. A little while later, he acquires a car, which he says his father gave him.  
  
Hmm, okay...  
I confront him and ask him why he isn't paying me back instead of buying things for himself. He tells me the PC was bought on an installment payment, so he didn't actually front all the money. We talk back and forth and I end up thinking that he's really not that well off and decide to do what I now regret. I tell Peter to forget about the money he owes me. That I don't want money to get in the way of our friendship.  
  
Couple months later I find out he's also bought a phone (Also an installment payment) and he's gotten rid of the previous car in favor of another one. At this point I feel violated. Instead of paying me back a little every month he has three installment payments (PC, phone, the 2nd car), a membership to a gym and can still afford gas for his car.  
  
I've talked with him and while he says he'll get the money our friendship is definitely ruined now. His argument is that I told him to forget about the money, mine that he was never honest with me about his financial situation. AITA?  
  
Non-native speaker, excuse any confusion please.  
  
EDIT: Please see my response to /u/BrainDojo's comment for further details."
502cdw,,"Well, I tipped her, just less than normal.

I went to a restaurant today and I knew I wanted a malt after my meal. When I was ordering my food, I asked the waitress if I could order it now but have it at the end, she said ""Yeah, I'll have them make it and put it in the freezer"" I told her I didn't want that, I wanted it made at the end and before I could say I'd wait to order it she said she could do it that way too.

A few times during my meal she asked did I want the malt yet and I reiterated that I would let her know when I was ready. After the meal I was signing the CC receipt I told her I was ready for the malt whenever she was (lazy day today, in no hurry) and I  saw her turn to the freezer and pull out the malt.....

So I asked her how long the malt was in there and if I wasn't clear about not wanting the malt until I asked for it and she said she had the guy make it ""like three minutes ago"" and was pretty visibly annoyed when she said she can make it again if I want. Obviously, which I said 3+ times, I wanted it when I asked for it, so I said okay and she re-made it, and I only tipped her 10%.

Am I the asshole for that?

Edit: words/sentence structure"
